{
  "id": "grand-guignol",
  "name": "Grand Guignol",
  "source": "Circus of Chaos",
  "flavor": "Every wire you've laid snaps taut at once, and for one terrible instant every puppet on your stage dances the same violent step.",
  "tier": "prestige",
  "discipline": "Animation",
  "minLevel": 5,
  "engineCost": 2,
  "castingTime": "1 action",
  "range": "60 feet",
  "components": [
    "Flourish",
    "Prop (a fistful of shears)"
  ],
  "duration": "Instantaneous",
  "save": "Strength",
  "description": "You sever every String at once, and the recoil slams each stringed body against itself. Every creature you currently have a String attached to within range is wrenched by its own wire: each makes a Strength saving throw against your {{trick save DC|8 + proficiency bonus + your trick ability modifier}}. On a failure, a creature takes [[3d8]] physical damage, is knocked prone, and is restrained until it or another creature uses an action to cut it free. On a success, it takes half as much damage and is neither knocked prone nor restrained. You must have at least two Strings attached to cast Grand Guignol, and when it resolves the String on every creature it targets detaches and is consumed at once — leaving you to re-establish your control from scratch.",
  "sheetSummary": "Once per combat. Action, 60 ft. Requires 2+ Strings attached; detaches and consumes the String on every creature it hits. Every Stringed creature in range: Str save vs trick save DC. Fail: [[3d8]] physical, prone + restrained (escape = an action to cut it free). Success: half damage only.",
  "classes": [
    "puppeteer"
  ]
}
