{
  "id": "master-of-ceremonies",
  "name": "Master of Ceremonies",
  "source": "Circus of Chaos",
  "flavor": "You throw your arms wide, and for the length of the introduction, you are exactly who the room needs you to be.",
  "tier": "turn",
  "discipline": "Illusion",
  "minLevel": 1,
  "cooldown": 1,
  "castingTime": "1 action",
  "range": "Self",
  "components": [
    "Patter",
    "Flourish",
    "Prop (a costume piece or mask)"
  ],
  "duration": "10 minutes",
  "description": "You wrap yourself in a small illusion of bearing and reputation — a borrowed title, a fresh face, an unearned air of importance. For the duration, you have advantage on Charisma (Deception) and Charisma (Performance) checks, and your voice and appearance seem subtly different (the color of your eyes, the cut of your clothes, small mannerisms) to anyone who hasn't already seen through the act. This trick cannot make you pass for a specific individual.",
  "sheetSummary": "Action, self, cooldown 1, 10 minutes. Advantage on Deception and Performance checks; minor cosmetic disguise (not impersonation of a specific person).",
  "classes": [
    "jester"
  ]
}
